{"meta":{"id":"bw_summary_340a40169fe08c6b","schemaVersion":"boreal.runtime.v1","createdAt":"2026-07-01T15:11:52.253Z","updatedAt":"2026-07-01T15:11:52.253Z","createdBy":{"id":"cybertron","kind":"human","displayName":"cybertron"},"updatedBy":{"id":"cybertron","kind":"human","displayName":"cybertron"},"sourceRefs":[],"tags":["agent-summary","closeout","task"],"contentHash":"sha256:9e3ab63e8e27adeef8a2a544bc8376cdbb69740bb830c2bdc1f4118b54f48193"},"subjectId":"bw_work_a99e751b23f33287","subjectType":"work","summaryKind":"task","status":"final","outcome":"completed","title":"Closeout summary: S02T06 - Compile git checkpoint and dirty-state directives","body":"## Agent Finish Summary\n\nImplemented Git checkpoint and dirty-state directive compilation for S02T06. Expanded git.checkpoint-required data to include typed Git root state, scoped changed paths, collaboration dirty paths, blocking dirty paths, untracked paths, protected-branch caveats, no-repo-change booleans, no-commit reasons, out-of-scope notes, last commit SHA, and repository-changed status. Added gitDirectiveDataByRegistryId and compileGitAgentDirectiveBundle and reused the typed Git data from closeout/summary compilation.\n\nClose reason: Completed S02T06 git checkpoint and dirty-state directive compilation","completedWork":[{"workId":"bw_work_a99e751b23f33287","title":"S02T06 - Compile git checkpoint and dirty-state directives","outcome":"completed","notes":"Completed S02T06 git checkpoint and dirty-state directive compilation"}],"evidenceIds":["bw_evidence_9554a5088be1260a"],"verificationIds":["bw_verification_c09d99a1832dbe91"],"commitShas":["b071178db860fda23f88e7abfa93fb474137afb2"],"dirtyPathNotes":["Unrelated pre-existing dirty paths remain outside this work: README.md, apps/cli/*, docs/*, package.json, tests/runtime/cli.test.ts, docs/architecture/PRIOR_ART_ORIGINALITY.md."],"childSummaryIds":["bw_summary_05d6ba0fe238f514","bw_summary_07c4ae5c19ffa1e5","bw_summary_2a7caf8953512628","bw_summary_311076e357a6bafe","bw_summary_359bf75265074108","bw_summary_3ea00ec742affb34","bw_summary_4ed51e1175af5394","bw_summary_5f3f59b762076602","bw_summary_6136cac2b9bdf9c6","bw_summary_62693cc4442e7577","bw_summary_7cf72da7fa044c67","bw_summary_9876907dbe994d01","bw_summary_ac61a71e807c452a","bw_summary_ed18463d66508fad"],"artifactUri":"memory://agent-summaries/works/bw_work_a99e751b23f33287/bw_summary_340a40169fe08c6b.md","generatedAt":"2026-07-01T15:11:52.253Z"}
