{"meta":{"id":"bw_summary_b28a37a6015f30ea","schemaVersion":"boreal.runtime.v1","createdAt":"2026-07-01T03:50:54.123Z","updatedAt":"2026-07-01T03:50:54.123Z","createdBy":{"id":"cybertron","kind":"human","displayName":"cybertron"},"updatedBy":{"id":"cybertron","kind":"human","displayName":"cybertron"},"sourceRefs":[],"tags":["agent-summary","legacy-backfill"],"contentHash":"sha256:fc78893b95e6e92493fefc11876afc2116c527c0aa0597a98562a7f389522ea0"},"subjectId":"bw_work_0d8cf33353154654","subjectType":"work","summaryKind":"legacy_backfill","status":"final","outcome":"completed","title":"Legacy summary: S08T06 - Add contradiction and stale truth repair workflows to doctor","body":"Implemented workflow-aware truth repair diagnostics with passing verification.","completedWork":[{"workId":"bw_work_0d8cf33353154654","title":"S08T06 - Add contradiction and stale truth repair workflows to doctor","outcome":"completed","notes":"Implemented workflow-aware truth repair diagnostics with passing verification."}],"evidenceIds":["bw_evidence_e807a8afaa6bc9da"],"verificationIds":["bw_verification_93528b40c445dbc6"],"commitShas":[],"dirtyPathNotes":["legacy_backfill: checkpoint unavailable for pre-policy terminal work"],"childSummaryIds":[],"artifactUri":"memory://agent-summaries/works/bw_work_0d8cf33353154654/bw_summary_b28a37a6015f30ea.md","generatedAt":"2026-07-01T03:50:54.123Z"}
