{"meta":{"id":"bw_summary_0485b8213aa35bc8","schemaVersion":"boreal.runtime.v1","createdAt":"2026-07-01T03:50:54.123Z","updatedAt":"2026-07-01T03:50:54.123Z","createdBy":{"id":"cybertron","kind":"human","displayName":"cybertron"},"updatedBy":{"id":"cybertron","kind":"human","displayName":"cybertron"},"sourceRefs":[],"tags":["agent-summary","legacy-backfill"],"contentHash":"sha256:9866d49725fe262079c867ceddb37d18cc145885babebb0cc0a795e3c8abc682"},"subjectId":"bw_work_b89f76d2d1eb1590","subjectType":"work","summaryKind":"legacy_backfill","status":"final","outcome":"completed","title":"Legacy summary: S08T05 - Link runtime claims and decisions to memory wiki pages","body":"Implemented runtime claim/decision wiki linkage and doctor coverage diagnostics with passing verification.","completedWork":[{"workId":"bw_work_b89f76d2d1eb1590","title":"S08T05 - Link runtime claims and decisions to memory wiki pages","outcome":"completed","notes":"Implemented runtime claim/decision wiki linkage and doctor coverage diagnostics with passing verification."}],"evidenceIds":["bw_evidence_c09e8b9f04344e0e"],"verificationIds":["bw_verification_47547c26bc61228f"],"commitShas":[],"dirtyPathNotes":["legacy_backfill: checkpoint unavailable for pre-policy terminal work"],"childSummaryIds":[],"artifactUri":"memory://agent-summaries/works/bw_work_b89f76d2d1eb1590/bw_summary_0485b8213aa35bc8.md","generatedAt":"2026-07-01T03:50:54.123Z"}
