{"meta":{"id":"bw_summary_9a01c9fd6a2007d6","schemaVersion":"boreal.runtime.v1","createdAt":"2026-07-01T03:50:25.313Z","updatedAt":"2026-07-01T03:50:25.313Z","createdBy":{"id":"cybertron","kind":"human","displayName":"cybertron"},"updatedBy":{"id":"cybertron","kind":"human","displayName":"cybertron"},"sourceRefs":[],"tags":["agent-summary","legacy-backfill"],"contentHash":"sha256:db704310f7f2a81e9567971244236dcca0fab95c5d39ca3e85fe980df5c43366"},"subjectId":"bw_work_60459710b0455152","subjectType":"milestone","summaryKind":"milestone","status":"final","outcome":"completed","title":"Legacy summary: Phase 02C - Optional rich status dashboards","body":"Optional rich status dashboards are implemented and verified.","completedWork":[{"workId":"bw_work_60459710b0455152","title":"Phase 02C - Optional rich status dashboards","outcome":"completed","notes":"Optional rich status dashboards are implemented and verified."}],"evidenceIds":["bw_evidence_17822827023cbd7e"],"verificationIds":["bw_verification_258519726c122e90"],"commitShas":[],"dirtyPathNotes":["legacy_backfill: checkpoint unavailable for pre-policy terminal work"],"childSummaryIds":[],"artifactUri":"memory://agent-summaries/milestones/bw_work_60459710b0455152/bw_summary_9a01c9fd6a2007d6.md","generatedAt":"2026-07-01T03:50:25.313Z"}
