{"meta":{"id":"bw_summary_de746ca413914eac","schemaVersion":"boreal.runtime.v1","createdAt":"2026-07-07T04:35:13.000Z","updatedAt":"2026-07-07T04:35:13.000Z","createdBy":{"id":"cybertron","kind":"human","displayName":"cybertron"},"updatedBy":{"id":"cybertron","kind":"human","displayName":"cybertron"},"sourceRefs":[],"tags":["agent-summary","milestone"],"contentHash":"sha256:f9fa31b4891517d67ce1a396d24fac0d124005152313aeda3edf784089c2fa43"},"subjectId":"bw_work_cc9d864c47c34baa","subjectType":"milestone","summaryKind":"milestone","status":"final","outcome":"completed","title":"Closeout summary: Agent-loop hardening: cut agent ceremony cost without weakening rails","body":"Subject: milestone:bw_work_cc9d864c47c34baa\nStatus: ready\nPriority: high\n\n## Outcome\n\nAudit of two real agent sessions (dump/agent1-orkflow.md, dump/agent 2 workflow.md) showed ~half of all tool calls were Boreal bookkeeping: a self-invalidating sync/doctor loop after every mutation, inconsistent JSON envelopes forcing jq guesswork, workflow refs that fail via bwrk workflows show, and 20k+ lines of repeated JSON per closeout. This milestone stabilizes contracts, removes self-inflicted staleness churn, shrinks output, rewrites workflows around golden-path commands, and locks it all in with transcript-replay regression tests. Enforcement semantics (gates, evidence, verification, summaries, blocked-until-children) do not change.\n\n## Evidence\n\nNone.\n\n## Verification\n\nNone.\n\n## Closeout Gates\n\nNone.\n\n## Review/Audit Gate Details\n\nNone.\n\n## Child Work\n\n- bw_work_2f07afe4a207a46f: closed Hardening S2: Remove the self-staleness sync/doctor ratchet\n- bw_work_1a22aa87decedf13: closed Auto-prune operation volume at the gate; widen warning grace\n- bw_work_1c93c0cdcf435894: closed Scope staleness and volume directives to closeout-relevant commands\n- bw_work_5476e1d6fd4b1f4b: closed sync refresh exits 0 on successful refresh; --strict opts into status exit\n- bw_work_9b9ac1a3465ac087: closed Mutating commands refresh derived artifacts inline\n- bw_work_a7bb9c5d12374674: closed Lock lifecycle: contention retry, single source of truth, decidable staleness\n- bw_work_77971342b74d3615: closed Hardening S1: Envelope and reference contracts\n- bw_work_168ca5ee1d5bf0e5: closed Uniform data.result block on every mutating command response\n- bw_work_2fdee15327628db4: closed Domain-accurate recovery text for not-found errors by record type\n- bw_work_5e51e2c55b98c622: closed Workflow ref resolution accepts workflows/ prefix and returns didYouMean\n- bw_work_6dca4409ad4ac24a: closed Unknown-flag errors suggest nearest registered flag\n- bw_work_8fc2e901435de2fb: closed Stable doctor and gate verdict shape under result truncation\n- bw_work_e6de7664fc624e59: closed Installed skills carry their workflow sources or reference canonical IDs only\n- bw_work_9ef6934194be3516: closed Hardening S4: Golden-path workflows and one-shot closeout\n- bw_work_104e5f9a54410b7e: closed sprint close composite generates metrics, report, and rollup summary\n- bw_work_25f49d2c2a07c396: closed One-shot finish for unreserved work\n- bw_work_2f07afe4a207a46f: closed Hardening S2: Remove the self-staleness sync/doctor ratchet\n- bw_work_3ae789cea5fc8f40: closed Route finish-work requests through claim/start in work-execution skill\n- bw_work_750a67aa09e8ebd9: closed Rewrite closeout-work.md around gate closeout and agent finish\n- bw_work_77971342b74d3615: closed Hardening S1: Envelope and reference contracts\n- bw_work_f14baaa786e881c4: closed Doc-truth lint: workflow refs and documented JSON paths validated by doctor\n- bw_work_bbd34b7ef6f302d8: closed Hardening S3: Output diet and per-command latency\n- bw_work_2f07afe4a207a46f: closed Hardening S2: Remove the self-staleness sync/doctor ratchet\n- bw_work_339c40f5a2f5ff9a: closed Add a brief JSON output profile\n- bw_work_955684b17c4a9349: closed Trim mutation response payloads\n- bw_work_963fc14a5f02f660: closed Directive bundle dedup via sourceHash\n- bw_work_c799e3ef3637122a: closed Scope directive snapshot reads; skip sync probe for read-only commands\n- bw_work_fac43657d420760d: closed Envelope size budget tests in CI\n- bw_work_f4989ca6003c5f79: closed Hardening S5: Transcript-replay regression harness and ceremony budget\n- bw_work_130627157d05e8ae: closed Replay regression tests for every audited transcript failure\n- bw_work_3992f6f5f1027854: closed Version-skew coverage for new envelope schemas\n- bw_work_51c5751805c8dae4: closed End-to-end ceremony budget test\n- bw_work_9ef6934194be3516: closed Hardening S4: Golden-path workflows and one-shot closeout\n- bw_work_bbd34b7ef6f302d8: closed Hardening S3: Output diet and per-command latency\n\n## Prior Summaries\n\nNone.","completedWork":[{"workId":"bw_work_cc9d864c47c34baa","title":"Agent-loop hardening: cut agent ceremony cost without weakening rails","outcome":"completed","notes":"Subject: milestone:bw_work_cc9d864c47c34baa"}],"evidenceIds":[],"verificationIds":[],"commitShas":[],"dirtyPathNotes":["sprint_checkpoint_rollup: all child sprint checkpoints verified before milestone closeout"],"childSummaryIds":[],"artifactUri":"memory://agent-summaries/milestones/bw_work_cc9d864c47c34baa/bw_summary_de746ca413914eac.md","generatedAt":"2026-07-07T04:35:13.000Z"}
