{"meta":{"id":"bw_summary_e500cdb7351700b5","schemaVersion":"boreal.runtime.v1","createdAt":"2026-07-02T06:19:22.820Z","updatedAt":"2026-07-02T06:19:22.820Z","createdBy":{"id":"cybertron","kind":"human","displayName":"cybertron"},"updatedBy":{"id":"cybertron","kind":"human","displayName":"cybertron"},"sourceRefs":[],"tags":["agent-summary","closeout","task"],"contentHash":"sha256:74dcc03e74f5ae0fa371fe51e720af8e4b5da995387d90b7e7fa5baf23cae79e"},"subjectId":"bw_work_64cbeba31ce6aeca","subjectType":"work","summaryKind":"task","status":"final","outcome":"completed","title":"Closeout summary: Replace dataRequirements with typed payload interfaces","body":"## Agent Finish Summary\n\nReplaced registry-owned dataRequirements with typed directive payload contracts. Added packages/core/src/agent-directive-payloads.ts with one payload interface and field contract per directive registry id, removed the registry requirement() helper and dataRequirements arrays, and switched compiler, health, CLI registry show, docs, and tests to consume agentDirectivePayloadFields. Also reused atomic storage writes for file lock owner heartbeat files so the full suite remains stable.\n\nClose reason: Typed payload contract migration complete and verified.","completedWork":[{"workId":"bw_work_64cbeba31ce6aeca","title":"Replace dataRequirements with typed payload interfaces","outcome":"completed","notes":"Typed payload contract migration complete and verified."}],"evidenceIds":["bw_evidence_8f5237a01801a3bd"],"verificationIds":["bw_verification_9e8e125ca883edf6"],"commitShas":[],"dirtyPathNotes":["git_unavailable: sandbox denied creating /Users/cybertron/Code/boreal-work/.git/index.lock during git add, so payload-contract and supporting file-lock changes remain unstaged in the working tree."],"childSummaryIds":["bw_summary_61b845fc11eabd64","bw_summary_7324b1d38aeec07a","bw_summary_7f2b688649b80747"],"artifactUri":"memory://agent-summaries/works/bw_work_64cbeba31ce6aeca/bw_summary_e500cdb7351700b5.md","generatedAt":"2026-07-02T06:19:22.820Z"}
