{"meta":{"id":"bw_summary_1bc400f3ce987ca1","schemaVersion":"boreal.runtime.v1","createdAt":"2026-07-07T15:48:14.901Z","updatedAt":"2026-07-07T15:48:14.901Z","createdBy":{"id":"cybertron","kind":"human","displayName":"cybertron"},"updatedBy":{"id":"cybertron","kind":"human","displayName":"cybertron"},"sourceRefs":[],"tags":["agent-summary","closeout","task"],"contentHash":"sha256:174516d8201de75b3fe51774661a0cd8ea9240ae99f6cc052e1a5e8868fb85d5"},"subjectId":"bw_work_6837ad9e915bd698","subjectType":"work","summaryKind":"task","status":"final","outcome":"completed","title":"Closeout summary: Global aggregator - daemon refresh with lazy TTL fallback","body":"## Agent Finish Summary\n\npnpm check passed. Implemented daemon-owned global rollup aggregation cache: linked projects refresh into registry cache files, broken projects are isolated as degraded, dashboard lazy reads reuse fresh cache entries, and stale cache rows are marked beyond TTL.\n\nClose reason: global rollup aggregation cache with daemon sweep and lazy TTL fallback complete","completedWork":[{"workId":"bw_work_6837ad9e915bd698","title":"Global aggregator - daemon refresh with lazy TTL fallback","outcome":"completed","notes":"global rollup aggregation cache with daemon sweep and lazy TTL fallback complete"}],"evidenceIds":["bw_evidence_7d3f4312b8cd348d"],"verificationIds":["bw_verification_0a85f3f58854b2a5"],"commitShas":["a70f19250ed13aae409792464f8565ca639c9dbd"],"dirtyPathNotes":["ambient_dirty_workspace: unrelated pre-existing Boreal tracker/generated/source changes remain unstaged"],"childSummaryIds":["bw_summary_23ca4543e302aad7","bw_summary_344f110bd4d0f291"],"artifactUri":"memory://agent-summaries/works/bw_work_6837ad9e915bd698/bw_summary_1bc400f3ce987ca1.md","generatedAt":"2026-07-07T15:48:14.901Z"}
