{"meta":{"id":"bw_summary_2b20327992d8c5b8","schemaVersion":"boreal.runtime.v1","createdAt":"2026-07-02T23:05:13.948Z","updatedAt":"2026-07-02T23:05:13.948Z","createdBy":{"id":"cybertron","kind":"human","displayName":"cybertron"},"updatedBy":{"id":"cybertron","kind":"human","displayName":"cybertron"},"sourceRefs":[],"tags":["agent-summary","closeout","sprint"],"contentHash":"sha256:7c35ecff4b1463170b008fea6f2b9900e9e47d834bd1dde33cd133db929012df"},"subjectId":"bw_work_62a47b9ec49699b5","subjectType":"sprint","summaryKind":"sprint","status":"final","outcome":"completed","title":"Closeout summary: H1 Free machinery: response-shape changes derived from existing state","body":"## Agent Finish Summary\n\nH1 completed: JSON response ledger stamps, work show --since, post-mutation state, retryable recovery errors, operation stats, and idempotent finish/release are implemented and verified.\n\nClose reason: Sprint scope completed for runtime hardening milestone.","completedWork":[{"workId":"bw_work_62a47b9ec49699b5","title":"H1 Free machinery: response-shape changes derived from existing state","outcome":"completed","notes":"Sprint scope completed for runtime hardening milestone."}],"evidenceIds":["bw_evidence_a6e1364755608212"],"verificationIds":["bw_verification_c2db3c26f5c7f488"],"commitShas":["12ba9e08"],"dirtyPathNotes":["out_of_scope: docs/product/GLOBAL_MANAGER_DESIGN.md left untracked"],"childSummaryIds":["bw_summary_007127d6382762c4","bw_summary_1e67b5252780609f","bw_summary_2d160a936bd40f2e","bw_summary_61313c331bcef0d1","bw_summary_88762512d2351be1"],"artifactUri":"memory://agent-summaries/sprints/bw_work_62a47b9ec49699b5/bw_summary_2b20327992d8c5b8.md","generatedAt":"2026-07-02T23:05:13.948Z"}
