{"meta":{"id":"bw_summary_85a5be5a240795d5","schemaVersion":"boreal.runtime.v1","createdAt":"2026-07-07T15:00:02.777Z","updatedAt":"2026-07-07T15:00:02.777Z","createdBy":{"id":"cybertron","kind":"human","displayName":"cybertron"},"updatedBy":{"id":"cybertron","kind":"human","displayName":"cybertron"},"sourceRefs":[],"tags":["agent-summary","closeout","task"],"contentHash":"sha256:1fd9686d19e52c1793c6b637719b7527f629391835fcd428414c61f03e6402c3"},"subjectId":"bw_work_b0c02f91b7314d3c","subjectType":"work","summaryKind":"task","status":"final","outcome":"completed","title":"Closeout summary: Contractual link and unlink semantics - non-invasive and reversible","body":"## Agent Finish Summary\n\nImplemented non-invasive global link/unlink semantics: global link now offers --init for fresh targets, existing workspace links write only the machine-local registry, global unlink archives by default, and purge requires --yes. Focused link/unlink and command-surface tests passed; pnpm check passed.\n\nClose reason: Link/unlink contract implemented, tested, documented, and committed.","completedWork":[{"workId":"bw_work_b0c02f91b7314d3c","title":"Contractual link and unlink semantics - non-invasive and reversible","outcome":"completed","notes":"Link/unlink contract implemented, tested, documented, and committed."}],"evidenceIds":["bw_evidence_5108bb5328df9940"],"verificationIds":["bw_verification_48fb5fda13b2df6d"],"commitShas":["b72b358e11686e5b45d97577144e99117aa4ae90"],"dirtyPathNotes":["pre_existing_unstaged: apps/cli/src/command-registry.ts, apps/cli/src/commands/dashboard.ts, docs/cli/COMMANDS.md contain unrelated prior edits left unstaged"],"childSummaryIds":["bw_summary_1ca74a8778f11ccc","bw_summary_23ca4543e302aad7"],"artifactUri":"memory://agent-summaries/works/bw_work_b0c02f91b7314d3c/bw_summary_85a5be5a240795d5.md","generatedAt":"2026-07-07T15:00:02.777Z"}
