{"meta":{"id":"bw_summary_b55e069542bb14d4","schemaVersion":"boreal.runtime.v1","createdAt":"2026-07-01T03:50:25.313Z","updatedAt":"2026-07-01T03:50:25.313Z","createdBy":{"id":"cybertron","kind":"human","displayName":"cybertron"},"updatedBy":{"id":"cybertron","kind":"human","displayName":"cybertron"},"sourceRefs":[],"tags":["agent-summary","legacy-backfill"],"contentHash":"sha256:373498f568c9603a15ab30aadf53df6305e037701456880909dd205ba573323d"},"subjectId":"bw_work_38ba809d13493164","subjectType":"work","summaryKind":"legacy_backfill","status":"final","outcome":"completed","title":"Legacy summary: S05T02 - Add registry list/add/remove/doctor commands","body":"Registry management commands are implemented and verified.","completedWork":[{"workId":"bw_work_38ba809d13493164","title":"S05T02 - Add registry list/add/remove/doctor commands","outcome":"completed","notes":"Registry management commands are implemented and verified."}],"evidenceIds":["bw_evidence_0fd86ddfc86c458c"],"verificationIds":["bw_verification_f93ee9a36e2ed026"],"commitShas":[],"dirtyPathNotes":["legacy_backfill: checkpoint unavailable for pre-policy terminal work"],"childSummaryIds":[],"artifactUri":"memory://agent-summaries/works/bw_work_38ba809d13493164/bw_summary_b55e069542bb14d4.md","generatedAt":"2026-07-01T03:50:25.313Z"}
