{"meta":{"id":"bw_summary_3b2b4a02bf55ad56","schemaVersion":"boreal.runtime.v1","createdAt":"2026-07-01T03:50:25.313Z","updatedAt":"2026-07-01T03:50:25.313Z","createdBy":{"id":"cybertron","kind":"human","displayName":"cybertron"},"updatedBy":{"id":"cybertron","kind":"human","displayName":"cybertron"},"sourceRefs":[],"tags":["agent-summary","legacy-backfill"],"contentHash":"sha256:84dda6630355800543dec6182e88665e1cb6e35144b0bdbb5d3ebe92cba67613"},"subjectId":"bw_work_0359c6fdc049d6dd","subjectType":"work","summaryKind":"legacy_backfill","status":"final","outcome":"completed","title":"Legacy summary: S07T01 - Implement raw inbox queue and source preview panels","body":"Raw inbox queue and source preview panels are implemented with immutable source-backed rows and graceful preview states.","completedWork":[{"workId":"bw_work_0359c6fdc049d6dd","title":"S07T01 - Implement raw inbox queue and source preview panels","outcome":"completed","notes":"Raw inbox queue and source preview panels are implemented with immutable source-backed rows and graceful preview states."}],"evidenceIds":["bw_evidence_7ab2cc7cc5f42d8b"],"verificationIds":["bw_verification_2af520a86d76f21c"],"commitShas":[],"dirtyPathNotes":["legacy_backfill: checkpoint unavailable for pre-policy terminal work"],"childSummaryIds":[],"artifactUri":"memory://agent-summaries/works/bw_work_0359c6fdc049d6dd/bw_summary_3b2b4a02bf55ad56.md","generatedAt":"2026-07-01T03:50:25.313Z"}
