{"meta":{"id":"bw_summary_33dea65250d213fb","schemaVersion":"boreal.runtime.v1","createdAt":"2026-07-01T18:04:20.177Z","updatedAt":"2026-07-01T18:04:20.177Z","createdBy":{"id":"cybertron","kind":"human","displayName":"cybertron"},"updatedBy":{"id":"cybertron","kind":"human","displayName":"cybertron"},"sourceRefs":[],"tags":["agent-summary","closeout","task"],"contentHash":"sha256:bc959aa339eec43e31930fd4a2d99e505fa2540d32b76aa1862391b52be1c4c7"},"subjectId":"bw_work_899ec001153f8f94","subjectType":"work","summaryKind":"task","status":"final","outcome":"completed","title":"Closeout summary: S03T05 - Implement directives compile, render, and explain commands","body":"## Agent Finish Summary\n\nImplemented directive debug compile, render, and explain CLI commands backed by the existing static directive registry and compiler. Added deterministic fixtures, markdown/json rendering, selector explanation output, command registry metadata, CLI docs, and runtime coverage. Verification passed: typecheck; directive envelope suite; command registry docs/completion/parser subset; agent directive compiler suite; live compile/render/explain smoke commands.\n\nClose reason: Directive debug commands implemented, documented, verified, and checkpointed.","completedWork":[{"workId":"bw_work_899ec001153f8f94","title":"S03T05 - Implement directives compile, render, and explain commands","outcome":"completed","notes":"Directive debug commands implemented, documented, verified, and checkpointed."}],"evidenceIds":["bw_evidence_25029a66df500916"],"verificationIds":["bw_verification_a8ef87b75e42ae7f"],"commitShas":["a47951af"],"dirtyPathNotes":["Unrelated pre-existing unstaged workspace edits remain outside this S03T05 commit: README.md, apps/cli/src/args.ts, apps/cli/src/cli-ui.ts, apps/cli/src/project-setup.ts, docs/*, package.json, tests/runtime/cli.test.ts, docs/architecture/PRIOR_ART_ORIGINALITY.md."],"childSummaryIds":["bw_summary_05d6ba0fe238f514","bw_summary_07c4ae5c19ffa1e5","bw_summary_2a7caf8953512628","bw_summary_311076e357a6bafe","bw_summary_340a40169fe08c6b","bw_summary_359bf75265074108","bw_summary_3ea00ec742affb34","bw_summary_3f8d4955da916b6b","bw_summary_43e4755ee4960acb","bw_summary_4ed51e1175af5394","bw_summary_521eed3387e65bdb","bw_summary_5f3f59b762076602","bw_summary_6136cac2b9bdf9c6","bw_summary_62693cc4442e7577","bw_summary_753282c238c0c4bc","bw_summary_7cf72da7fa044c67","bw_summary_9876907dbe994d01","bw_summary_ac61a71e807c452a","bw_summary_c6158b6837dcd3c6","bw_summary_d86f3fbc06bf8c67","bw_summary_eba133df4303195d","bw_summary_ed18463d66508fad"],"artifactUri":"memory://agent-summaries/works/bw_work_899ec001153f8f94/bw_summary_33dea65250d213fb.md","generatedAt":"2026-07-01T18:04:20.177Z"}
