{"meta":{"id":"bw_summary_1dae25ddaba108f9","schemaVersion":"boreal.runtime.v1","createdAt":"2026-07-01T03:50:25.313Z","updatedAt":"2026-07-01T03:50:25.313Z","createdBy":{"id":"cybertron","kind":"human","displayName":"cybertron"},"updatedBy":{"id":"cybertron","kind":"human","displayName":"cybertron"},"sourceRefs":[],"tags":["agent-summary","legacy-backfill"],"contentHash":"sha256:2ea6289653aec66d9c21d68d4637f117a42fe9a3aa556ccb5ac8f7f29529aa4b"},"subjectId":"bw_work_3e4ef779557f2eab","subjectType":"sprint","summaryKind":"sprint","status":"final","outcome":"completed","title":"Legacy summary: Sprint 01 - Truth baseline and dashboard contracts","body":"All Sprint 01 phase gates are closed and the baseline/contracts work is verified.","completedWork":[{"workId":"bw_work_3e4ef779557f2eab","title":"Sprint 01 - Truth baseline and dashboard contracts","outcome":"completed","notes":"All Sprint 01 phase gates are closed and the baseline/contracts work is verified."}],"evidenceIds":["bw_evidence_50e46462d4c126bc"],"verificationIds":["bw_verification_34de86f8d05d2ab2"],"commitShas":[],"dirtyPathNotes":["legacy_backfill: checkpoint unavailable for pre-policy terminal work"],"childSummaryIds":[],"artifactUri":"memory://agent-summaries/sprints/bw_work_3e4ef779557f2eab/bw_summary_1dae25ddaba108f9.md","generatedAt":"2026-07-01T03:50:25.313Z"}
