{"meta":{"id":"bw_summary_344f110bd4d0f291","schemaVersion":"boreal.runtime.v1","createdAt":"2026-07-07T15:30:13.282Z","updatedAt":"2026-07-07T15:30:13.282Z","createdBy":{"id":"cybertron","kind":"human","displayName":"cybertron"},"updatedBy":{"id":"cybertron","kind":"human","displayName":"cybertron"},"sourceRefs":[],"tags":["agent-summary","closeout","task"],"contentHash":"sha256:d5a4d02ca0fd0183f2be092970fcfc621d8d4573e3c45ff52db107963ed39b52"},"subjectId":"bw_work_034a98a67c8eda38","subjectType":"work","summaryKind":"task","status":"final","outcome":"completed","title":"Closeout summary: Rollup projection schema and per-project producer","body":"## Agent Finish Summary\n\nImplemented the versioned project rollup projection schema, atomic per-project .boreal/rollup.json producer, bwrk rollup show --json inspector, sync/doctor integration, stale validation, docs, and regression coverage. Focused runtime/CLI/schema tests passed, and pnpm check passed after commit 383c1b054e61c600a70511566022aa5c5ed45df5.\n\nClose reason: rollup projection schema and per-project producer complete","completedWork":[{"workId":"bw_work_034a98a67c8eda38","title":"Rollup projection schema and per-project producer","outcome":"completed","notes":"rollup projection schema and per-project producer complete"}],"evidenceIds":["bw_evidence_86315265c83e20a2"],"verificationIds":["bw_verification_6d3685ddedeee360"],"commitShas":["383c1b054e61c600a70511566022aa5c5ed45df5"],"dirtyPathNotes":["ambient_dirty_workspace: unrelated pre-existing Boreal tracker/generated/source changes remain unstaged"],"childSummaryIds":[],"artifactUri":"memory://agent-summaries/works/bw_work_034a98a67c8eda38/bw_summary_344f110bd4d0f291.md","generatedAt":"2026-07-07T15:30:13.282Z"}
