{"meta":{"id":"bw_summary_61313c331bcef0d1","schemaVersion":"boreal.runtime.v1","createdAt":"2026-07-02T23:01:22.451Z","updatedAt":"2026-07-02T23:01:22.451Z","createdBy":{"id":"cybertron","kind":"human","displayName":"cybertron"},"updatedBy":{"id":"cybertron","kind":"human","displayName":"cybertron"},"sourceRefs":[],"tags":["agent-summary","closeout","task"],"contentHash":"sha256:bbbe7f8e512608969d138522c9c2337fe0aaa56af824a46910ea6ca3df0dcbf6"},"subjectId":"bw_work_bb8e04af25c1c8cb","subjectType":"work","summaryKind":"task","status":"final","outcome":"completed","title":"Closeout summary: Idempotent agent finish and work release","body":"## Agent Finish Summary\n\nMade agent finish and work release idempotent for already-terminal same-agent lifecycle paths.\n\nClose reason: Completed for runtime hardening milestone.","completedWork":[{"workId":"bw_work_bb8e04af25c1c8cb","title":"Idempotent agent finish and work release","outcome":"completed","notes":"Completed for runtime hardening milestone."}],"evidenceIds":["bw_evidence_8627fcbd3180bb8d"],"verificationIds":["bw_verification_b43032e36c4a5f18"],"commitShas":["12ba9e08"],"dirtyPathNotes":["out_of_scope: docs/product/GLOBAL_MANAGER_DESIGN.md left untracked"],"childSummaryIds":[],"artifactUri":"memory://agent-summaries/works/bw_work_bb8e04af25c1c8cb/bw_summary_61313c331bcef0d1.md","generatedAt":"2026-07-02T23:01:22.451Z"}
