{"meta":{"id":"bw_summary_b639f03c321be217","schemaVersion":"boreal.runtime.v1","createdAt":"2026-07-04T00:44:40.430Z","updatedAt":"2026-07-04T00:44:40.430Z","createdBy":{"id":"cybertron","kind":"human","displayName":"cybertron"},"updatedBy":{"id":"cybertron","kind":"human","displayName":"cybertron"},"sourceRefs":[],"tags":["agent-summary","closeout","task"],"contentHash":"sha256:f369bb628eca3034bbaabfd4ef0b66030acee9307f9f4e64434a8405fde2e047"},"subjectId":"bw_work_8fc2e901435de2fb","subjectType":"work","summaryKind":"task","status":"final","outcome":"completed","title":"Closeout summary: Stable doctor and gate verdict shape under result truncation","body":"## Agent Finish Summary\n\nImplemented stable doctor and gate closeout verdict fields under result truncation. Doctor results now expose blockingDiagnosticCodes, gate closeout exposes top-level fixed and blockingDiagnosticCodes plus nested doctor blocking codes, and spooled doctor/gate results copy ok/fixed/blockingDiagnosticCodes to the same data paths as inline results. Verification passed; git checkpoint could not be completed because .git/index.lock writes were denied while staging mixed-file hunks.\n\nClose reason: implemented and verified; commit checkpoint blocked by sandbox git index lock","completedWork":[{"workId":"bw_work_8fc2e901435de2fb","title":"Stable doctor and gate verdict shape under result truncation","outcome":"completed","notes":"implemented and verified; commit checkpoint blocked by sandbox git index lock"}],"evidenceIds":["bw_evidence_645634b1dc5c27fd"],"verificationIds":["bw_verification_3c17b3a8fdbf127c"],"commitShas":[],"dirtyPathNotes":["git_unavailable: apps/cli/src/doctor.ts apps/cli/src/output.ts tests/runtime/output.test.ts staged before checkpoint failure","git_unavailable: apps/cli/src/commands.ts contains required gate verdict changes plus unrelated pre-existing ready queue hunks","git_unavailable: tests/runtime/cli.test.ts contains required verdict assertions plus unrelated pre-existing didYouMean/ready queue hunks"],"childSummaryIds":[],"artifactUri":"memory://agent-summaries/works/bw_work_8fc2e901435de2fb/bw_summary_b639f03c321be217.md","generatedAt":"2026-07-04T00:44:40.430Z"}
