{"meta":{"id":"bw_summary_221244bf8d3350e8","schemaVersion":"boreal.runtime.v1","createdAt":"2026-07-01T03:50:54.123Z","updatedAt":"2026-07-01T03:50:54.123Z","createdBy":{"id":"cybertron","kind":"human","displayName":"cybertron"},"updatedBy":{"id":"cybertron","kind":"human","displayName":"cybertron"},"sourceRefs":[],"tags":["agent-summary","legacy-backfill"],"contentHash":"sha256:fb3b3931bdc1d69165ddeab4bec27b62aa63c1a57c30f9730f315d15b5461a0c"},"subjectId":"bw_work_e26e3751f058721d","subjectType":"sprint","summaryKind":"sprint","status":"final","outcome":"completed","title":"Legacy summary: Sprint 13 - CLI lifecycle and memory command adoption","body":"Sprint 13 implementation and verification complete.","completedWork":[{"workId":"bw_work_e26e3751f058721d","title":"Sprint 13 - CLI lifecycle and memory command adoption","outcome":"completed","notes":"Sprint 13 implementation and verification complete."}],"evidenceIds":["bw_evidence_82d08b2b6aba940f"],"verificationIds":["bw_verification_9e2dfea96c57df51"],"commitShas":[],"dirtyPathNotes":["legacy_backfill: checkpoint unavailable for pre-policy terminal work"],"childSummaryIds":[],"artifactUri":"memory://agent-summaries/sprints/bw_work_e26e3751f058721d/bw_summary_221244bf8d3350e8.md","generatedAt":"2026-07-01T03:50:54.123Z"}
