{"meta":{"id":"bw_summary_44238edd50125df2","schemaVersion":"boreal.runtime.v1","createdAt":"2026-07-01T02:21:52.853Z","updatedAt":"2026-07-01T02:21:52.853Z","createdBy":{"id":"cybertron","kind":"human","displayName":"cybertron"},"updatedBy":{"id":"cybertron","kind":"human","displayName":"cybertron"},"sourceRefs":[],"tags":["agent-summary","closeout","task"],"contentHash":"sha256:2d426203e51aaac89aac6c56bc050fd2dcf97ee72bab1151a04a1a26f8029414"},"subjectId":"bw_work_b0575962b2bbf531","subjectType":"work","summaryKind":"task","status":"final","outcome":"completed","title":"Closeout summary: Add recent closed-work query command","body":"## Agent Finish Summary\n\nImplemented bwrk work recent-closed against durable closed work records and work.closed events; verified with TypeScript, focused recent-closed CLI coverage, and the full CLI runtime suite.\n\nClose reason: recent closed work query command implemented and verified","completedWork":[{"workId":"bw_work_b0575962b2bbf531","title":"Add recent closed-work query command","outcome":"completed","notes":"recent closed work query command implemented and verified"}],"evidenceIds":["bw_evidence_7cea155db3d423bb"],"verificationIds":["bw_verification_2a47fd3bcfc2df96"],"commitShas":["32cbc5f"],"dirtyPathNotes":[],"childSummaryIds":["bw_summary_61cf4405d9128a3b","bw_summary_962394539a70361e","bw_summary_b2389bd9c37efece","bw_summary_ca739184666f3107","bw_summary_e906c06d6b61d7dc"],"artifactUri":"memory://agent-summaries/works/bw_work_b0575962b2bbf531/bw_summary_44238edd50125df2.md","generatedAt":"2026-07-01T02:21:52.853Z"}
