{"meta":{"id":"bw_summary_4cb77e827b9f6c23","schemaVersion":"boreal.runtime.v1","createdAt":"2026-07-02T18:44:15.697Z","updatedAt":"2026-07-02T18:44:15.697Z","createdBy":{"id":"cybertron","kind":"human","displayName":"cybertron"},"updatedBy":{"id":"cybertron","kind":"human","displayName":"cybertron"},"sourceRefs":[],"tags":["agent-summary","closeout","task"],"contentHash":"sha256:ba56ef3edbe092164efff46aab709c1ce28718820ebbc72a33ca2acf8e355d75"},"subjectId":"bw_work_32fcca3fa8d9dc32","subjectType":"work","summaryKind":"task","status":"final","outcome":"completed","title":"Closeout summary: Self-contained dist build with bin entry and channel detection","body":"## Agent Finish Summary\n\npnpm check passed. Added esbuild-powered CLI dist bundle with bin package scripts, install channel reporting, bundled workflow/template/schema asset resolution, and copied-dist smoke coverage.\n\nClose reason: completed bundled CLI distribution task","completedWork":[{"workId":"bw_work_32fcca3fa8d9dc32","title":"Self-contained dist build with bin entry and channel detection","outcome":"completed","notes":"completed bundled CLI distribution task"}],"evidenceIds":["bw_evidence_5116e2095f23b29d"],"verificationIds":["bw_verification_882c029341423ed9"],"commitShas":["7ec6ea19d9dc04f23a05fd0efd614aea2fa15d29"],"dirtyPathNotes":["unrelated_dirty_state: pre-existing unrelated dirty paths remain in apps/cli/src/command-registry.ts, apps/mcp/src/tools.ts, docs/cli/COMMANDS.md, packages/engine/src/runtime.ts, tests/runtime/mcp.test.ts, workflows/40-work/claim-and-finish-work.md, and docs/product/GLOBAL_MANAGER_DESIGN.md","unrelated_dirty_state: mixed files apps/cli/src/commands.ts and tests/runtime/cli.test.ts retain unstaged pre-existing hunks outside this distribution task"],"childSummaryIds":[],"artifactUri":"memory://agent-summaries/works/bw_work_32fcca3fa8d9dc32/bw_summary_4cb77e827b9f6c23.md","generatedAt":"2026-07-02T18:44:15.697Z"}
