{"meta":{"id":"bw_summary_962394539a70361e","schemaVersion":"boreal.runtime.v1","createdAt":"2026-07-01T02:05:33.018Z","updatedAt":"2026-07-01T02:05:33.018Z","createdBy":{"id":"cybertron","kind":"human","displayName":"cybertron"},"updatedBy":{"id":"cybertron","kind":"human","displayName":"cybertron"},"sourceRefs":[],"tags":["agent-summary","closeout","task"],"contentHash":"sha256:14ea78cb520c8aec25afd2c8061dedc67ce9edc47b6d2e95edc6c4e46b58c1d1"},"subjectId":"bw_work_bf03e16bada47a53","subjectType":"work","summaryKind":"task","status":"final","outcome":"completed","title":"Closeout summary: Expose review and audit gate planning in CLI workflows","body":"## Agent Finish Summary\n\nExposed required review/audit gate planning and status through CLI outputs, workflow docs, and regression coverage. Evidence, verification, and summary commands now surface closeoutGateStatus; work edit can force a planned gate with audited metadata.\n\nClose reason: review and audit gate CLI workflow exposure implemented and verified","completedWork":[{"workId":"bw_work_bf03e16bada47a53","title":"Expose review and audit gate planning in CLI workflows","outcome":"completed","notes":"review and audit gate CLI workflow exposure implemented and verified"}],"evidenceIds":["bw_evidence_3d96f5f06cb9c9fb"],"verificationIds":["bw_verification_7842d29c69ebc59d"],"commitShas":["1e15175"],"dirtyPathNotes":[],"childSummaryIds":["bw_summary_61cf4405d9128a3b","bw_summary_ca739184666f3107","bw_summary_e906c06d6b61d7dc"],"artifactUri":"memory://agent-summaries/works/bw_work_bf03e16bada47a53/bw_summary_962394539a70361e.md","generatedAt":"2026-07-01T02:05:33.018Z"}
