{"meta":{"id":"bw_summary_967f03a4de5c117e","schemaVersion":"boreal.runtime.v1","createdAt":"2026-07-05T18:22:43.034Z","updatedAt":"2026-07-05T18:22:43.034Z","createdBy":{"id":"cybertron","kind":"human","displayName":"cybertron"},"updatedBy":{"id":"cybertron","kind":"human","displayName":"cybertron"},"sourceRefs":[],"tags":["agent-summary","closeout","task"],"contentHash":"sha256:5bc8532eaceab255a7e364822eff3af0a4ce03cc42d9203d4dff97d911a1c311"},"subjectId":"bw_work_4ef420806f403b5e","subjectType":"work","summaryKind":"task","status":"final","outcome":"completed","title":"Closeout summary: T7 Finish gate honors worktree","body":"## Agent Finish Summary\n\nImplemented agent finish support for recorded worktrees: branch/head/dirty checks now run against reservation.git.worktreePath, closeout stamps the worktree head, Git finish evidence probes the worktree, and --remove-worktree prunes after successful close.\n\nClose reason: done","completedWork":[{"workId":"bw_work_4ef420806f403b5e","title":"T7 Finish gate honors worktree","outcome":"completed","notes":"done"}],"evidenceIds":["bw_evidence_b82bf3b04785ecc8"],"verificationIds":["bw_verification_47ec09029bdd2fde"],"commitShas":["7f43c456062a7ab68d3e205b79f86e260f95b140"],"dirtyPathNotes":[],"childSummaryIds":["bw_summary_945e7a6472b6eeb1"],"artifactUri":"memory://agent-summaries/works/bw_work_4ef420806f403b5e/bw_summary_967f03a4de5c117e.md","generatedAt":"2026-07-05T18:22:43.034Z"}
