{"meta":{"id":"bw_summary_c01c5024919809a3","schemaVersion":"boreal.runtime.v1","createdAt":"2026-07-04T00:29:42.674Z","updatedAt":"2026-07-04T00:29:42.674Z","createdBy":{"id":"cybertron","kind":"human","displayName":"cybertron"},"updatedBy":{"id":"cybertron","kind":"human","displayName":"cybertron"},"sourceRefs":[],"tags":["agent-summary","closeout","task"],"contentHash":"sha256:4828517ac37b69bbdba15caa1960594d3ebcd4875c8705ee94b3064e183495c7"},"subjectId":"bw_work_6dca4409ad4ac24a","subjectType":"work","summaryKind":"task","status":"final","outcome":"completed","title":"Closeout summary: Unknown-flag errors suggest nearest registered flag","body":"## Agent Finish Summary\n\nImplemented unknown-flag suggestions in validateCommandFlags. Unknown registered-command flags now include a message hint and details.didYouMean when a nearest allowed flag is available; --parent is treated as a known alias for --container, and --prio suggests --priority. Extended the CLI unknown-flag test to assert --parent on work list suggests --container and --prio suggests --priority. Verification passed: pnpm check; pnpm vitest run tests/runtime/cli.test.ts -t 'rejects unknown flags'; pnpm vitest run tests/runtime/cli.test.ts; pnpm bwrk docs check --json; git diff --check. Commit checkpoint was attempted earlier in this sandbox and failed because .git writes are denied, so closeout records a git_unavailable dirty-path note.\n\nClose reason: Unknown-flag didYouMean recovery implemented and verified; git checkpoint blocked by sandboxed .git write permissions.","completedWork":[{"workId":"bw_work_6dca4409ad4ac24a","title":"Unknown-flag errors suggest nearest registered flag","outcome":"completed","notes":"Unknown-flag didYouMean recovery implemented and verified; git checkpoint blocked by sandboxed .git write permissions."}],"evidenceIds":["bw_evidence_09cd6941785a3cbe"],"verificationIds":["bw_verification_b6c51b2b060fe013"],"commitShas":[],"dirtyPathNotes":["git_unavailable: sandbox denies writes under .git/index.lock; checkpoint diff for this work remains in apps/cli/src/command-registry.ts and tests/runtime/cli.test.ts"],"childSummaryIds":[],"artifactUri":"memory://agent-summaries/works/bw_work_6dca4409ad4ac24a/bw_summary_c01c5024919809a3.md","generatedAt":"2026-07-04T00:29:42.674Z"}
