{"meta":{"id":"bw_summary_bec93874bff1c90f","schemaVersion":"boreal.runtime.v1","createdAt":"2026-07-02T23:05:29.676Z","updatedAt":"2026-07-02T23:05:29.676Z","createdBy":{"id":"cybertron","kind":"human","displayName":"cybertron"},"updatedBy":{"id":"cybertron","kind":"human","displayName":"cybertron"},"sourceRefs":[],"tags":["agent-summary","closeout","sprint"],"contentHash":"sha256:40d19abf521c7fcb33bea5399821b759668b4d48458e49e600d36f307d5914df"},"subjectId":"bw_work_47ba02626578872b","subjectType":"sprint","summaryKind":"sprint","status":"final","outcome":"completed","title":"Closeout summary: H2 Hardened machinery: fail-closed guards and self-healing health","body":"## Agent Finish Summary\n\nH2 completed: auto git evidence, evidence-gated closeout, circuit breakers, self-healing search, git-to-tracker drift detection, and stale reservation reap errors are implemented and verified.\n\nClose reason: Sprint scope completed for runtime hardening milestone.","completedWork":[{"workId":"bw_work_47ba02626578872b","title":"H2 Hardened machinery: fail-closed guards and self-healing health","outcome":"completed","notes":"Sprint scope completed for runtime hardening milestone."}],"evidenceIds":["bw_evidence_5da6476035ec67e7"],"verificationIds":["bw_verification_5ca256a2e7e82114"],"commitShas":["12ba9e08"],"dirtyPathNotes":["out_of_scope: docs/product/GLOBAL_MANAGER_DESIGN.md left untracked"],"childSummaryIds":["bw_summary_0da443a1c35abb65","bw_summary_4ae5f081dc798cc8","bw_summary_52904a73ac4b2d8d","bw_summary_57b06bc31ac762c2","bw_summary_9f213fb649d0296d","bw_summary_d1154d249c155ae9"],"artifactUri":"memory://agent-summaries/sprints/bw_work_47ba02626578872b/bw_summary_bec93874bff1c90f.md","generatedAt":"2026-07-02T23:05:29.676Z"}
