{"meta":{"id":"bw_summary_1dfa1052783f513f","schemaVersion":"boreal.runtime.v1","createdAt":"2026-07-01T03:50:25.313Z","updatedAt":"2026-07-01T03:50:25.313Z","createdBy":{"id":"cybertron","kind":"human","displayName":"cybertron"},"updatedBy":{"id":"cybertron","kind":"human","displayName":"cybertron"},"sourceRefs":[],"tags":["agent-summary","legacy-backfill"],"contentHash":"sha256:3d1d874ca408616ff43c1914fae5f26e1af5a6884b9c64e93d2ec93b6a8cf471"},"subjectId":"bw_work_abdd58eae33f9127","subjectType":"work","summaryKind":"legacy_backfill","status":"final","outcome":"completed","title":"Legacy summary: S01T01 - Snapshot live Boreal state and command coverage","body":"Baseline state and command coverage are documented with strict doctor evidence and current work counts.","completedWork":[{"workId":"bw_work_abdd58eae33f9127","title":"S01T01 - Snapshot live Boreal state and command coverage","outcome":"completed","notes":"Baseline state and command coverage are documented with strict doctor evidence and current work counts."}],"evidenceIds":["bw_evidence_6337b5d344082542"],"verificationIds":["bw_verification_1223d59f88595414"],"commitShas":[],"dirtyPathNotes":["legacy_backfill: checkpoint unavailable for pre-policy terminal work"],"childSummaryIds":[],"artifactUri":"memory://agent-summaries/works/bw_work_abdd58eae33f9127/bw_summary_1dfa1052783f513f.md","generatedAt":"2026-07-01T03:50:25.313Z"}
